<?xml version="1.0" encoding="UTF-8"?>
<!-- <!DOCTYPE products SYSTEM "validation.dtd"> -->
<products xmlns:xsi="http://www.w3.org/2001/XMLSchema-instance" xsi:noNamespaceSchemaLocation="validation.xsd">
  <product>
    <id>123</id>
    <name>Laptop</name>
    <price>400</price>
    <quantity>100</quantity>
    <category>Electronics</category>
  </product>
  <product>
    <id>456</id>
    <name>T-shirt</name>
    <price>20</price>
    <quantity>50</quantity>
    <category>Clothing</category>
  </product>
  <product>
    <id>789</id>
    <name>Silient Patient</name>
    <price>100</price>
    <quantity>100</quantity>
    <category>Books</category>
  </product>
</products>
